{"schema_version":"1","manifest_id":"battery_snl_lfp_source_entry_binding_manifest_v1","bounded_source_id":"snl_lfp_commercial_18650_study","review_recorded_on":"2026-07-26","review_scope":"SNL LFP.zip archive identity plus source-backed condition-group entry-pattern mapping; no payload or CSV reads","archive_identity":{"archive_path":"data/raw/battery_archive/SNL LFP.zip","archive_sha256":"006a335cbcdabc858a85ab0cdbc59a7001150751cf22abe8a7132c85ef63223d","archive_size_bytes":263826451,"entry_manifest_checksum":"f85e6f1ac333f7ff20b7bfd01b8599cfe86e8950c4971e9fc074a367da86a75c","observed_entry_count":60,"observed_cell_pair_count":30,"row_level_manifest_committed":false,"condition_groups_derived_from":"local v2.6.6 central-directory entry-name audit","provider_published_archive_checksum":false,"provider_versioned_distribution_id":null},"source_register":[{"source_id":"battery_archive_snl_study_page","url":"https://www.batteryarchive.org/snl_study.html","scope":"study identity and protocol families","versioned_dataset_snapshot":false,"official_archive_checksum_published":false},{"source_id":"battery_archive_metadata_rules","url":"https://batteryarchive.org/metadata.html","scope":"filename-token semantics and limitations","versioned_dataset_snapshot":false,"official_archive_checksum_published":false},{"source_id":"battery_archive_access_policy","url":"https://www.batteryarchive.org/faq.html","scope":"bulk-download and attribution policy","versioned_dataset_snapshot":false,"official_archive_checksum_published":false},{"source_id":"osti_1650174_article_record","url":"https://www.osti.gov/pages/biblio/1650174","scope":"DOI, OSTI ID, SAND number and Battery Archive availability statement","versioned_dataset_snapshot":false,"official_archive_checksum_published":false},{"source_id":"sandia_sand2020_8433j_record","url":"https://www.sandia.gov/research/publications/details/degradation-of-commercial-lithium-ion-cells-as-a-function-of-chemistry-and-2020-01-09/","scope":"Sandia publication identity and Battery Archive availability statement","versioned_dataset_snapshot":false,"official_archive_checksum_published":false}],"binding_dimensions":[{"dimension":"publication_to_repository","status":"established","evidence_source_ids":["osti_1650174_article_record","sandia_sand2020_8433j_record","battery_archive_snl_study_page"],"evidence":"The publication records state that the study cycling files are available at Battery Archive, and the Battery Archive SNL page identifies the dataset as the data used in the publication.","limitation":"This establishes repository attribution, not the identity of a particular downloaded ZIP."},{"dimension":"repository_filename_nomenclature","status":"established","evidence_source_ids":["battery_archive_metadata_rules"],"evidence":"Battery Archive defines the SNL/form-factor/cathode/temperature/SOC/rate/replicate token semantics used by the observed names.","limitation":"Metadata labels describe bulk-cycling conditions and may not describe capacity-check cycles."},{"dimension":"study_to_condition_group","status":"established_condition_group_only","evidence_source_ids":["battery_archive_snl_study_page","battery_archive_metadata_rules"],"evidence":"The official study page defines the temperature, SOC-window, charge-rate, discharge-rate and protocol-family meanings represented by the 12 observed filename patterns.","limitation":"No original laboratory cell ID or serial number is exposed in the filenames."},{"dimension":"condition_group_to_entry_pattern","status":"established_repository_nomenclature_only","evidence_source_ids":["battery_archive_metadata_rules","battery_archive_snl_study_page"],"evidence":"Thirty observed cell stems aggregate into 12 safe cycle/time-series filename patterns whose tokens conform to the official nomenclature.","limitation":"The row-level central-directory manifest remains local and the pattern binding does not prove file payload semantics."},{"dimension":"physical_cell_to_entry","status":"not_established","evidence_source_ids":["battery_archive_metadata_rules"],"evidence":"The optional original-cell-ID token is absent from the SNL LFP names.","limitation":"Replicate letters are not documented physical serial numbers or laboratory channel IDs."},{"dimension":"cycle_command_to_rows","status":"not_established","evidence_source_ids":["battery_archive_snl_study_page","battery_archive_metadata_rules"],"evidence":"Study-level protocol families are documented.","limitation":"No command log, cycle-step map, CSV header, or row payload has been read or bound."},{"dimension":"instrument_channel_to_columns","status":"not_established","evidence_source_ids":["battery_archive_snl_study_page"],"evidence":"Arbin systems, chambers, and K-type thermocouples are documented at study level.","limitation":"No channel mapping, calibration record, accuracy specification, or CSV column binding is available."},{"dimension":"official_distribution_snapshot","status":"not_established","evidence_source_ids":["battery_archive_access_policy","osti_1650174_article_record","sandia_sand2020_8433j_record"],"evidence":"The repository and publication identities are stable.","limitation":"No release ID, retrieval timestamp issued by the provider, official ZIP checksum, signed manifest, or versioned distribution record identifies the observed archive."}],"condition_group_bindings":[{"group_id":"snl_lfp_group_01","entry_pattern":"SNL LFP/SNL_18650_LFP_15C_0-100_0.5-1C_{replicate}_{cycle_data|timeseries}.csv","institution_code":"SNL","form_factor":"18650","chemistry_label":"LFP","environment_temperature_c":15,"soc_window_percent":"0-100","charge_rate_c":0.5,"discharge_rate_c":1.0,"replicate_labels":["a","b"],"observed_cell_count":2,"observed_entry_pair_count":2,"study_protocol_family":"0-100% SOC bulk cycling: 0.5C charge with CCCV; LFP 2.0-3.6 V regime; discharge rate from filename label","mapping_level":"condition_group_entry_pattern","physical_cell_identity_established":false,"exact_cycle_command_binding_established":false,"exact_cutoff_value_bound_to_entries":false},{"group_id":"snl_lfp_group_02","entry_pattern":"SNL LFP/SNL_18650_LFP_15C_0-100_0.5-2C_{replicate}_{cycle_data|timeseries}.csv","institution_code":"SNL","form_factor":"18650","chemistry_label":"LFP","environment_temperature_c":15,"soc_window_percent":"0-100","charge_rate_c":0.5,"discharge_rate_c":2.0,"replicate_labels":["a","b"],"observed_cell_count":2,"observed_entry_pair_count":2,"study_protocol_family":"0-100% SOC bulk cycling: 0.5C charge with CCCV; LFP 2.0-3.6 V regime; discharge rate from filename label","mapping_level":"condition_group_entry_pattern","physical_cell_identity_established":false,"exact_cycle_command_binding_established":false,"exact_cutoff_value_bound_to_entries":false},{"group_id":"snl_lfp_group_03","entry_pattern":"SNL LFP/SNL_18650_LFP_25C_0-100_0.5-0.5C_{replicate}_{cycle_data|timeseries}.csv","institution_code":"SNL","form_factor":"18650","chemistry_label":"LFP","environment_temperature_c":25,"soc_window_percent":"0-100","charge_rate_c":0.5,"discharge_rate_c":0.5,"replicate_labels":["a"],"observed_cell_count":1,"observed_entry_pair_count":1,"study_protocol_family":"0-100% SOC bulk cycling: 0.5C charge with CCCV; LFP 2.0-3.6 V regime; discharge rate from filename label","mapping_level":"condition_group_entry_pattern","physical_cell_identity_established":false,"exact_cycle_command_binding_established":false,"exact_cutoff_value_bound_to_entries":false},{"group_id":"snl_lfp_group_04","entry_pattern":"SNL LFP/SNL_18650_LFP_25C_0-100_0.5-1C_{replicate}_{cycle_data|timeseries}.csv","institution_code":"SNL","form_factor":"18650","chemistry_label":"LFP","environment_temperature_c":25,"soc_window_percent":"0-100","charge_rate_c":0.5,"discharge_rate_c":1.0,"replicate_labels":["a","b","c","d"],"observed_cell_count":4,"observed_entry_pair_count":4,"study_protocol_family":"0-100% SOC bulk cycling: 0.5C charge with CCCV; LFP 2.0-3.6 V regime; discharge rate from filename label","mapping_level":"condition_group_entry_pattern","physical_cell_identity_established":false,"exact_cycle_command_binding_established":false,"exact_cutoff_value_bound_to_entries":false},{"group_id":"snl_lfp_group_05","entry_pattern":"SNL LFP/SNL_18650_LFP_25C_0-100_0.5-2C_{replicate}_{cycle_data|timeseries}.csv","institution_code":"SNL","form_factor":"18650","chemistry_label":"LFP","environment_temperature_c":25,"soc_window_percent":"0-100","charge_rate_c":0.5,"discharge_rate_c":2.0,"replicate_labels":["a","b"],"observed_cell_count":2,"observed_entry_pair_count":2,"study_protocol_family":"0-100% SOC bulk cycling: 0.5C charge with CCCV; LFP 2.0-3.6 V regime; discharge rate from filename label","mapping_level":"condition_group_entry_pattern","physical_cell_identity_established":false,"exact_cycle_command_binding_established":false,"exact_cutoff_value_bound_to_entries":false},{"group_id":"snl_lfp_group_06","entry_pattern":"SNL LFP/SNL_18650_LFP_25C_0-100_0.5-3C_{replicate}_{cycle_data|timeseries}.csv","institution_code":"SNL","form_factor":"18650","chemistry_label":"LFP","environment_temperature_c":25,"soc_window_percent":"0-100","charge_rate_c":0.5,"discharge_rate_c":3.0,"replicate_labels":["a","b","c","d"],"observed_cell_count":4,"observed_entry_pair_count":4,"study_protocol_family":"0-100% SOC bulk cycling: 0.5C charge with CCCV; LFP 2.0-3.6 V regime; discharge rate from filename label","mapping_level":"condition_group_entry_pattern","physical_cell_identity_established":false,"exact_cycle_command_binding_established":false,"exact_cutoff_value_bound_to_entries":false},{"group_id":"snl_lfp_group_07","entry_pattern":"SNL LFP/SNL_18650_LFP_25C_20-80_0.5-0.5C_{replicate}_{cycle_data|timeseries}.csv","institution_code":"SNL","form_factor":"18650","chemistry_label":"LFP","environment_temperature_c":25,"soc_window_percent":"20-80","charge_rate_c":0.5,"discharge_rate_c":0.5,"replicate_labels":["a","b","c","d"],"observed_cell_count":4,"observed_entry_pair_count":4,"study_proto